{"$schema":"https://json-schema.org/draft/2020-12/schema","title":"Conversation Core v0.1","type":"object","additionalProperties":false,"required":["schema_version","core_id","participants","interaction_patterns","callbacks","tone_transitions","boundaries","repair_preferences","metadata"],"properties":{"schema_version":{"const":"0.1.0"},"core_id":{"type":"string","minLength":1},"participants":{"type":"array","items":{"$ref":"#/$defs/participant"}},"interaction_patterns":{"$ref":"#/$defs/items"},"callbacks":{"$ref":"#/$defs/items"},"tone_transitions":{"$ref":"#/$defs/items"},"boundaries":{"$ref":"#/$defs/items"},"repair_preferences":{"$ref":"#/$defs/items"},"metadata":{"type":"object","additionalProperties":true,"required":["source_conversation_ids","generated_at","generator"],"properties":{"source_conversation_ids":{"type":"array","items":{"type":"string"}},"generated_at":{"type":"string"},"generator":{"type":"string"}}}},"$defs":{"participant":{"type":"object","additionalProperties":false,"required":["id","role"],"properties":{"id":{"type":"string"},"role":{"enum":["user","assistant","system","other"]}}},"provenance":{"type":"object","additionalProperties":false,"required":["conversation_id","message_ids"],"properties":{"conversation_id":{"type":"string"},"message_ids":{"type":"array","minItems":1,"items":{"type":"string"}}}},"item":{"type":"object","additionalProperties":false,"required":["id","type","summary","scope","status","confidence","sensitivity","provenance","created_at","updated_at"],"properties":{"id":{"type":"string"},"type":{"enum":["interaction_pattern","callback","tone_transition","boundary","repair_preference"]},"summary":{"type":"string"},"scope":{"type":"array","minItems":1,"items":{"enum":["global","casual","work","creative","support","technical"]}},"status":{"enum":["candidate","active","deprecated","retracted","archived"]},"confidence":{"type":"number","minimum":0,"maximum":1},"sensitivity":{"enum":["low","moderate","high"]},"provenance":{"type":"array","items":{"$ref":"#/$defs/provenance"}},"created_at":{"type":"string"},"updated_at":{"type":"string"}}},"items":{"type":"array","items":{"$ref":"#/$defs/item"}}}}
