{"schema_version":"0.1.0","core_id":"fixture-001-core","participants":[{"id":"user_a","role":"user"},{"id":"assistant_a","role":"assistant"}],"interaction_patterns":[{"id":"interaction_pattern-001","type":"interaction_pattern","summary":"Connect rapid topic transitions instead of resetting the conversation.","scope":["global"],"status":"active","confidence":0.85,"sensitivity":"low","provenance":[{"conversation_id":"fixture-001","message_ids":["m1","m2"]}],"created_at":"2026-01-01T00:00:00Z","updated_at":"2026-01-01T00:00:00Z"}],"callbacks":[],"tone_transitions":[],"boundaries":[],"repair_preferences":[],"metadata":{"source_conversation_ids":["fixture-001"],"generated_at":"2026-01-01T00:00:00Z","generator":"conversation-core/heuristic-v0.1"}}
